{
  "schema_version": "1.0.0",
  "candidates": [
    {
      "id": "qwen3.8-max__plain-agent",
      "model": "qwen3.8-max",
      "agent": "plain-agent",
      "adapter": "bailian-live",
      "config": {"profile": "benchmark_fast", "seed": 20260819}
    },
    {
      "id": "glm-5.2__plain-agent",
      "model": "glm-5.2",
      "agent": "plain-agent",
      "adapter": "bailian-live",
      "config": {"profile": "benchmark_fast", "seed": 20260819}
    },
    {
      "id": "deepseek-v4-flash-0731__plain-agent",
      "model": "deepseek-v4-flash-0731",
      "agent": "plain-agent",
      "adapter": "bailian-live",
      "config": {"profile": "benchmark_fast", "seed": 20260819}
    },
    {
      "id": "deepseek-v4-pro-0813__plain-agent",
      "model": "deepseek-v4-pro-0813",
      "agent": "plain-agent",
      "adapter": "bailian-live",
      "config": {"profile": "benchmark_fast", "seed": 20260819}
    }
  ],
  "providers": [
    {
      "name": "bailian",
      "api": "openai_chat_completions_compatible",
      "protocol": "openai_chat_completions",
      "adapter": "bailian",
      "base_url": "https://token-plan.cn-beijing.maas.aliyuncs.com/compatible-mode/v1",
      "credential_env": "BENCH_BAILIAN_API_KEY",
      "default_generation": {
        "stream": "on",
        "reasoning": {"mode": "auto"},
        "max_output_tokens": 512,
        "temperature": "0.600000",
        "top_p": "1.000000"
      },
      "timeout_seconds": 120
    }
  ],
  "models": [
    {
      "model_id": "qwen3.8-max",
      "provider": "bailian",
      "allowed_response_model_ids": ["qwen3.8-max"],
      "capabilities": {
        "stream": "supported",
        "reasoning": "required",
        "reasoning_controls": ["effort", "budget_tokens"],
        "reasoning_output": "reasoning_content"
      },
      "default_generation": {"reasoning": {"mode": "on", "effort": "low"}}
    },
    {
      "model_id": "glm-5.2",
      "provider": "bailian",
      "allowed_response_model_ids": ["glm-5.2"],
      "capabilities": {
        "stream": "supported",
        "reasoning": "optional",
        "reasoning_controls": ["enable_flag"],
        "reasoning_output": "reasoning_content"
      }
    },
    {
      "model_id": "deepseek-v4-flash-0731",
      "provider": "bailian",
      "allowed_response_model_ids": ["deepseek-v4-flash-0731"],
      "capabilities": {
        "stream": "supported",
        "reasoning": "optional",
        "reasoning_controls": ["enable_flag"],
        "reasoning_output": "reasoning_content"
      }
    },
    {
      "model_id": "deepseek-v4-pro-0813",
      "provider": "bailian",
      "allowed_response_model_ids": ["deepseek-v4-pro-0813"],
      "capabilities": {
        "stream": "supported",
        "reasoning": "optional",
        "reasoning_controls": ["enable_flag"],
        "reasoning_output": "reasoning_content"
      }
    }
  ],
  "profiles": [
    {
      "name": "benchmark_fast",
      "generation": {
        "stream": "on",
        "reasoning": {"mode": "auto"},
        "max_output_tokens": 512
      }
    },
    {
      "name": "non_streaming_control",
      "generation": {
        "stream": "off",
        "reasoning": {"mode": "auto"},
        "max_output_tokens": 512
      }
    }
  ]
}
